{"compatibleWake":"0.2.0","configuration":{},"contributions":["schema","query","capability","ui","route"],"dependencies":[],"durableSchemaVersion":1,"entry":"plugin.wake","exports":{"capabilities":["read-release"],"commands":[],"components":["release-card"],"entities":["release"],"providerPorts":["release-summary"],"queries":["release-by-id"],"routes":["release-detail"]},"extensionPorts":[{"accepts":["explicit-storage-id","immutable"],"cardinality":"many","kind":"entity-fields","name":"release-fields","target":"release"},{"accepts":["component"],"cardinality":"one","kind":"component-slot","name":"release-card","target":"release-card"},{"accepts":["release-id","route-path"],"cardinality":"one","kind":"route-slot","name":"release-detail","target":"release-detail"}],"migrations":[],"packageId":"wake-composition-plugin","pluginAbiVersion":1,"requiredHostCapabilities":["release-summary"],"schemaVersion":1,"sources":["plugin.wake"],"storageIds":{"entities":{"release":"wake-composition-plugin/entity/release"},"fields":{"release/id":"wake-composition-plugin/field/release/id","release/state":"wake-composition-plugin/field/release/state"}},"version":"0.1.0"}
