{"compatibleWake":"1.0.0","configuration":{"channel":{"required":true,"type":{"kind":"string"}}},"contributions":["schema","query","command","capability","ui","route"],"dependencies":[],"durableSchemaVersion":1,"entry":"plugin.wake","exports":{"capabilities":["approve-release"],"commands":["approve-release"],"components":["release-card"],"entities":["release"],"providerPorts":["release-summary"],"queries":["release-by-id"],"routes":["release-detail"]},"extensionPorts":[{"accepts":["field"],"cardinality":"many","kind":"entity-fields","name":"release-fields","target":"release"}],"migrations":[{"command":"bootstrap-release","fromVersion":0,"ordinal":1,"toVersion":1}],"packageId":"wake-neutral-release","pluginAbiVersion":1,"requiredHostCapabilities":["provider:release-summary"],"schemaVersion":1,"sources":["plugin.wake"],"storageIds":{"entities":{"release":"wake-neutral-release/entity/release"},"fields":{"release/id":"wake-neutral-release/field/release/id","release/state":"wake-neutral-release/field/release/state"}},"version":"0.1.0"}
