{"compatibleWake":"0.1.0","configuration":{"actor-entity":{"required":true,"type":{"declarationKind":"entity","kind":"symbol"}},"author-field":{"required":true,"type":{"declarationId":"revision/author","declarationKind":"field","kind":"symbol"}},"base-field":{"required":true,"type":{"declarationId":"revision/based-on","declarationKind":"field","kind":"symbol"}},"content-limits":{"required":true,"type":{"closed":true,"fields":[{"name":"titleBytes","required":true,"type":{"kind":"integer","maximum":1048576,"minimum":1}},{"name":"titleScalars","required":true,"type":{"kind":"integer","maximum":1048576,"minimum":1}},{"name":"summaryBytes","required":true,"type":{"kind":"integer","maximum":1048576,"minimum":1}},{"name":"contentSourceBytes","required":true,"type":{"kind":"integer","maximum":1048576,"minimum":1}},{"name":"links","required":true,"type":{"kind":"integer","maximum":200,"minimum":0}}],"kind":"record"}},"content-source-field":{"required":true,"type":{"declarationId":"revision/content-source","declarationKind":"field","kind":"symbol"}},"created-at-field":{"required":true,"type":{"declarationId":"revision/created-at","declarationKind":"field","kind":"symbol"}},"digest-field":{"required":true,"type":{"declarationId":"revision/digest","declarationKind":"field","kind":"symbol"}},"draft-pointer":{"required":true,"type":{"declarationId":"resource/draft-revision","declarationKind":"field","kind":"symbol"}},"draft-state":{"required":true,"type":{"kind":"keyword"}},"lifecycle-type":{"required":true,"type":{"declarationId":"RevisionLifecycle","declarationKind":"state","kind":"symbol"}},"links-field":{"required":true,"type":{"declarationId":"revision/links-to","declarationKind":"field","kind":"symbol"}},"owner-field":{"required":true,"type":{"declarationId":"revision/resource","declarationKind":"field","kind":"symbol"}},"published-at-field":{"required":true,"type":{"declarationId":"revision/published-at","declarationKind":"field","kind":"symbol"}},"published-pointer":{"required":true,"type":{"declarationId":"resource/published-revision","declarationKind":"field","kind":"symbol"}},"published-state":{"required":true,"type":{"kind":"keyword"}},"query-limits":{"required":true,"type":{"closed":true,"fields":[{"name":"browseDefault","required":true,"type":{"kind":"integer","maximum":247,"minimum":1}},{"name":"browseMax","required":true,"type":{"kind":"integer","maximum":247,"minimum":1}},{"name":"historyDefault","required":true,"type":{"kind":"integer","maximum":247,"minimum":1}},{"name":"historyMax","required":true,"type":{"kind":"integer","maximum":247,"minimum":1}},{"name":"backlinksDefault","required":true,"type":{"kind":"integer","maximum":247,"minimum":1}},{"name":"backlinksMax","required":true,"type":{"kind":"integer","maximum":247,"minimum":1}}],"kind":"record"}},"receipt-result-resource-field":{"required":true,"type":{"declarationId":"receipt-result-resource-field","declarationKind":"field","kind":"symbol"}},"receipt-result-revision-field":{"required":true,"type":{"declarationId":"receipt-result-revision-field","declarationKind":"field","kind":"symbol"}},"replaces-field":{"required":true,"type":{"declarationId":"revision/replaces-draft","declarationKind":"field","kind":"symbol"}},"resource":{"required":true,"type":{"declarationId":"resource","declarationKind":"entity","kind":"symbol"}},"resource-id":{"required":true,"type":{"declarationId":"resource/id","declarationKind":"field","kind":"symbol"}},"revision":{"required":true,"type":{"declarationId":"revision","declarationKind":"entity","kind":"symbol"}},"revision-id":{"required":true,"type":{"declarationId":"revision/id","declarationKind":"field","kind":"symbol"}},"safe-document-limits":{"required":true,"type":{"closed":true,"fields":[{"name":"maxBytes","required":true,"type":{"kind":"integer","maximum":1048576,"minimum":1}},{"name":"maxDepth","required":true,"type":{"kind":"integer","maximum":256,"minimum":5}},{"name":"maxNodes","required":true,"type":{"kind":"integer","maximum":65536,"minimum":1}}],"kind":"record"}},"state-field":{"required":true,"type":{"declarationId":"revision/state","declarationKind":"field","kind":"symbol"}},"summary-field":{"required":true,"type":{"declarationId":"revision/summary","declarationKind":"field","kind":"symbol"}},"superseded-state":{"required":true,"type":{"kind":"keyword"}},"title-field":{"required":true,"type":{"declarationId":"revision/title","declarationKind":"field","kind":"symbol"}}},"contributions":["schema","query","command","capability","ui","route"],"dependencies":[],"durableSchemaVersion":1,"entry":"plugin.bjs","exports":{"capabilities":["browse-published","read-published","read-draft","review-draft","read-history","read-backlinks","create-draft","start-draft","replace-own-draft","abandon-own-draft","abandon-any-draft","publish-draft"],"commands":["create-resource-draft","start-revision-draft","replace-draft","abandon-draft","publish"],"components":["browse-page","new-draft-page","read-page","edit-draft-page","review-page","history-page","resource-card","revision-summary","safe-document","link-list","backlink-list","conflict-notice"],"entities":["resource","revision"],"providerPorts":["content-parser"],"queries":["browse-published","read-published","read-source-for-draft","read-draft","review","history-current","history-superseded","backlinks"],"routes":["browse","new","read","edit","review","history"],"valueTypes":["SafeDocument"]},"extensionPorts":[{"accepts":["immutable","explicit-storage-id"],"cardinality":"many","kind":"entity-fields","name":"revision-fields","target":"revision"},{"accepts":["server-injected","explicit-storage-id"],"cardinality":"many","kind":"entity-fields","name":"receipt-fields","target":"wake.core/command-receipt"},{"accepts":["route-path"],"cardinality":"one","kind":"route-slot","name":"browse","target":"browse"},{"accepts":["route-path"],"cardinality":"one","kind":"route-slot","name":"new","target":"new"},{"accepts":["route-path","resource-id"],"cardinality":"one","kind":"route-slot","name":"read","target":"read"},{"accepts":["route-path","resource-id"],"cardinality":"one","kind":"route-slot","name":"edit","target":"edit"},{"accepts":["route-path","resource-id"],"cardinality":"one","kind":"route-slot","name":"review","target":"review"},{"accepts":["route-path","resource-id"],"cardinality":"one","kind":"route-slot","name":"history","target":"history"}],"migrations":[],"packageId":"wake-wiki","pluginAbiVersion":1,"requiredHostCapabilities":["content-parser"],"schemaVersion":1,"sources":["plugin.bjs"],"storageIds":{"entities":{"resource":"wake-wiki/entity/resource","revision":"wake-wiki/entity/revision"},"fields":{"receipt-result-resource-field":"wake-wiki/field/receipt/result-resource","receipt-result-revision-field":"wake-wiki/field/receipt/result-revision","resource/draft-revision":"wake-wiki/field/resource/draft-revision","resource/id":"wake-wiki/field/resource/id","resource/published-revision":"wake-wiki/field/resource/published-revision","revision/author":"wake-wiki/field/revision/author","revision/based-on":"wake-wiki/field/revision/based-on","revision/content-source":"wake-wiki/field/revision/content-source","revision/created-at":"wake-wiki/field/revision/created-at","revision/digest":"wake-wiki/field/revision/digest","revision/id":"wake-wiki/field/revision/id","revision/links-to":"wake-wiki/field/revision/links-to","revision/published-at":"wake-wiki/field/revision/published-at","revision/replaces-draft":"wake-wiki/field/revision/replaces-draft","revision/resource":"wake-wiki/field/revision/resource","revision/state":"wake-wiki/field/revision/state","revision/summary":"wake-wiki/field/revision/summary","revision/title":"wake-wiki/field/revision/title"}},"version":"0.1.0"}
