{"compatibleWake":"0.2.0","configuration":{"document":{"required":true,"type":{"declarationId":"document","declarationKind":"entity","kind":"symbol"}},"draft-state":{"required":true,"type":{"kind":"keyword"}},"identity-field":{"required":true,"type":{"declarationId":"document/id","declarationKind":"field","kind":"symbol"}},"lifecycle":{"required":true,"type":{"declarationId":"Lifecycle","declarationKind":"state","kind":"symbol"}},"limits":{"required":true,"type":{"closed":true,"fields":[{"name":"default","required":true,"type":{"kind":"integer","maximum":247,"minimum":1}},{"name":"maximum","required":true,"type":{"kind":"integer","maximum":247,"minimum":1}}],"kind":"record"}},"published-state":{"required":true,"type":{"kind":"keyword"}},"state-field":{"required":true,"type":{"declarationId":"document/state","declarationKind":"field","kind":"symbol"}}},"contributions":["schema","query","capability"],"dependencies":[],"durableSchemaVersion":1,"entry":"plugin.wake","exports":{"capabilities":["browse"],"commands":[],"components":[],"entities":["document"],"providerPorts":[],"queries":["browse"],"routes":[]},"extensionPorts":[{"accepts":["explicit-storage-id","immutable"],"cardinality":"many","kind":"entity-fields","name":"document-fields","target":"document"}],"migrations":[],"packageId":"wake-configured-plugin","pluginAbiVersion":1,"requiredHostCapabilities":[],"schemaVersion":1,"sources":["plugin.wake"],"storageIds":{"entities":{"document":"wake-configured-plugin/entity/document"},"fields":{"document/id":"wake-configured-plugin/field/document/id","document/state":"wake-configured-plugin/field/document/state"}},"version":"0.1.0"}
